{
  "schema_version": "1.0.0",
  "id": "id-example-0001",
  "created_at": "2026-07-26T12:00:00Z",
  "correlation_id": "correlation_id-example-0001",
  "trace_id": "trace_id-example-0001",
  "run_id": "run_id-example-0001",
  "tool_call_id": "tool_call_id-example-0001",
  "action": "action-example-0001",
  "resource_summary": "resource_summary-example-0001",
  "effect_summary": "effect_summary-example-0001",
  "risk_tier": "R0",
  "request_digest": "sha256:aaaaaaaaaaaaaaaaaaaaaaaaaaaaaaaaaaaaaaaaaaaaaaaaaaaaaaaaaaaaaaaa",
  "requested_scopes": [
    "example-requested-sc"
  ],
  "expires_at": "2026-07-26T12:00:00Z"
}
